{
  "edges": [
    {
      "from": "module:admin/build/gen_chrome.py",
      "source": {
        "end": 10,
        "line": 10,
        "path": "admin/build/gen_chrome.py",
        "sha256": "702aec56f2c9d2e87b138e944e07d6c66f60b459519c545e913ef75bfa9189fe"
      },
      "to": "module:admin/build/chrome.py",
      "verb": "imports"
    },
    {
      "from": "module:admin/build/gen_chrome.py",
      "source": {
        "end": 11,
        "line": 11,
        "path": "admin/build/gen_chrome.py",
        "sha256": "702aec56f2c9d2e87b138e944e07d6c66f60b459519c545e913ef75bfa9189fe"
      },
      "to": "module:admin/build/pages.py",
      "verb": "imports"
    },
    {
      "from": "module:admin/build/gen_diagrams.py",
      "source": {
        "end": 19,
        "line": 19,
        "path": "admin/build/gen_diagrams.py",
        "sha256": "69537df6149d2acd562ee0b2e4860d4ae8e6ca9bfe5d49cf22f059b0e2b87d8b"
      },
      "to": "module:admin/build/chrome.py",
      "verb": "imports"
    },
    {
      "from": "module:admin/build/gen_diagrams.py",
      "source": {
        "end": 20,
        "line": 20,
        "path": "admin/build/gen_diagrams.py",
        "sha256": "69537df6149d2acd562ee0b2e4860d4ae8e6ca9bfe5d49cf22f059b0e2b87d8b"
      },
      "to": "module:admin/build/pages.py",
      "verb": "imports"
    },
    {
      "from": "module:admin/build/gen_docs.py",
      "source": {
        "end": 15,
        "line": 15,
        "path": "admin/build/gen_docs.py",
        "sha256": "698761ae15847e90ccbb88367274f78b408fa1ce549b30d9c995b494a1126984"
      },
      "to": "module:admin/build/chrome.py",
      "verb": "imports"
    },
    {
      "from": "module:admin/build/gen_docs.py",
      "source": {
        "end": 15,
        "line": 15,
        "path": "admin/build/gen_docs.py",
        "sha256": "698761ae15847e90ccbb88367274f78b408fa1ce549b30d9c995b494a1126984"
      },
      "to": "module:admin/build/chrome.py",
      "verb": "imports"
    },
    {
      "from": "module:admin/build/gen_docs.py",
      "source": {
        "end": 15,
        "line": 15,
        "path": "admin/build/gen_docs.py",
        "sha256": "698761ae15847e90ccbb88367274f78b408fa1ce549b30d9c995b494a1126984"
      },
      "to": "module:admin/build/chrome.py",
      "verb": "imports"
    },
    {
      "from": "module:admin/build/gen_docs.py",
      "source": {
        "end": 16,
        "line": 16,
        "path": "admin/build/gen_docs.py",
        "sha256": "698761ae15847e90ccbb88367274f78b408fa1ce549b30d9c995b494a1126984"
      },
      "to": "module:admin/build/md_to_html.py",
      "verb": "imports"
    },
    {
      "from": "module:admin/build/gen_docs.py",
      "source": {
        "end": 17,
        "line": 17,
        "path": "admin/build/gen_docs.py",
        "sha256": "698761ae15847e90ccbb88367274f78b408fa1ce549b30d9c995b494a1126984"
      },
      "to": "module:admin/build/pages.py",
      "verb": "imports"
    },
    {
      "from": "module:admin/build/gen_features.py",
      "source": {
        "end": 14,
        "line": 14,
        "path": "admin/build/gen_features.py",
        "sha256": "63bc6861ed19d7b228822d7b1dd7f9225a1c7f113c5b68fcc0839f73649312f0"
      },
      "to": "module:admin/build/chrome.py",
      "verb": "imports"
    },
    {
      "from": "module:admin/build/gen_features.py",
      "source": {
        "end": 14,
        "line": 14,
        "path": "admin/build/gen_features.py",
        "sha256": "63bc6861ed19d7b228822d7b1dd7f9225a1c7f113c5b68fcc0839f73649312f0"
      },
      "to": "module:admin/build/chrome.py",
      "verb": "imports"
    },
    {
      "from": "module:admin/build/gen_features.py",
      "source": {
        "end": 14,
        "line": 14,
        "path": "admin/build/gen_features.py",
        "sha256": "63bc6861ed19d7b228822d7b1dd7f9225a1c7f113c5b68fcc0839f73649312f0"
      },
      "to": "module:admin/build/chrome.py",
      "verb": "imports"
    },
    {
      "from": "module:admin/build/gen_features.py",
      "source": {
        "end": 14,
        "line": 14,
        "path": "admin/build/gen_features.py",
        "sha256": "63bc6861ed19d7b228822d7b1dd7f9225a1c7f113c5b68fcc0839f73649312f0"
      },
      "to": "module:admin/build/chrome.py",
      "verb": "imports"
    },
    {
      "from": "module:admin/build/gen_features.py",
      "source": {
        "end": 15,
        "line": 15,
        "path": "admin/build/gen_features.py",
        "sha256": "63bc6861ed19d7b228822d7b1dd7f9225a1c7f113c5b68fcc0839f73649312f0"
      },
      "to": "module:admin/build/pages.py",
      "verb": "imports"
    },
    {
      "from": "module:admin/build/gen_llms.py",
      "source": {
        "end": 12,
        "line": 12,
        "path": "admin/build/gen_llms.py",
        "sha256": "9964a8d3d69c884b142ec26e5de2d4fad1dab137ae98609159cd30e7f416d930"
      },
      "to": "module:admin/build/chrome.py",
      "verb": "imports"
    },
    {
      "from": "module:admin/build/gen_llms.py",
      "source": {
        "end": 12,
        "line": 12,
        "path": "admin/build/gen_llms.py",
        "sha256": "9964a8d3d69c884b142ec26e5de2d4fad1dab137ae98609159cd30e7f416d930"
      },
      "to": "module:admin/build/chrome.py",
      "verb": "imports"
    },
    {
      "from": "module:admin/build/gen_llms.py",
      "source": {
        "end": 12,
        "line": 12,
        "path": "admin/build/gen_llms.py",
        "sha256": "9964a8d3d69c884b142ec26e5de2d4fad1dab137ae98609159cd30e7f416d930"
      },
      "to": "module:admin/build/chrome.py",
      "verb": "imports"
    },
    {
      "from": "module:admin/build/gen_llms.py",
      "source": {
        "end": 12,
        "line": 12,
        "path": "admin/build/gen_llms.py",
        "sha256": "9964a8d3d69c884b142ec26e5de2d4fad1dab137ae98609159cd30e7f416d930"
      },
      "to": "module:admin/build/chrome.py",
      "verb": "imports"
    },
    {
      "from": "module:admin/build/gen_llms.py",
      "source": {
        "end": 12,
        "line": 12,
        "path": "admin/build/gen_llms.py",
        "sha256": "9964a8d3d69c884b142ec26e5de2d4fad1dab137ae98609159cd30e7f416d930"
      },
      "to": "module:admin/build/chrome.py",
      "verb": "imports"
    },
    {
      "from": "module:admin/build/gen_llms.py",
      "source": {
        "end": 12,
        "line": 12,
        "path": "admin/build/gen_llms.py",
        "sha256": "9964a8d3d69c884b142ec26e5de2d4fad1dab137ae98609159cd30e7f416d930"
      },
      "to": "module:admin/build/chrome.py",
      "verb": "imports"
    },
    {
      "from": "module:admin/build/gen_llms.py",
      "source": {
        "end": 13,
        "line": 13,
        "path": "admin/build/gen_llms.py",
        "sha256": "9964a8d3d69c884b142ec26e5de2d4fad1dab137ae98609159cd30e7f416d930"
      },
      "to": "module:admin/build/pages.py",
      "verb": "imports"
    },
    {
      "from": "module:admin/build/gen_search.py",
      "source": {
        "end": 14,
        "line": 14,
        "path": "admin/build/gen_search.py",
        "sha256": "c95b637874318ad5a0839625693482f95195299b393261dceb04564408cbf050"
      },
      "to": "module:admin/build/chrome.py",
      "verb": "imports"
    },
    {
      "from": "module:admin/build/gen_search.py",
      "source": {
        "end": 14,
        "line": 14,
        "path": "admin/build/gen_search.py",
        "sha256": "c95b637874318ad5a0839625693482f95195299b393261dceb04564408cbf050"
      },
      "to": "module:admin/build/chrome.py",
      "verb": "imports"
    },
    {
      "from": "module:admin/build/gen_search.py",
      "source": {
        "end": 15,
        "line": 15,
        "path": "admin/build/gen_search.py",
        "sha256": "c95b637874318ad5a0839625693482f95195299b393261dceb04564408cbf050"
      },
      "to": "module:admin/build/pages.py",
      "verb": "imports"
    },
    {
      "from": "module:admin/build/gen_terms.py",
      "source": {
        "end": 19,
        "line": 19,
        "path": "admin/build/gen_terms.py",
        "sha256": "ab0f2a822249d4770c876b3a458384833a77ef78fcc9e7955e62e909c1658e8c"
      },
      "to": "module:admin/build/chrome.py",
      "verb": "imports"
    },
    {
      "from": "module:admin/build/gen_terms.py",
      "source": {
        "end": 19,
        "line": 19,
        "path": "admin/build/gen_terms.py",
        "sha256": "ab0f2a822249d4770c876b3a458384833a77ef78fcc9e7955e62e909c1658e8c"
      },
      "to": "module:admin/build/chrome.py",
      "verb": "imports"
    },
    {
      "from": "module:admin/build/gen_terms.py",
      "source": {
        "end": 20,
        "line": 20,
        "path": "admin/build/gen_terms.py",
        "sha256": "ab0f2a822249d4770c876b3a458384833a77ef78fcc9e7955e62e909c1658e8c"
      },
      "to": "module:admin/build/pages.py",
      "verb": "imports"
    },
    {
      "from": "module:admin/build/gen_twins.py",
      "source": {
        "end": 10,
        "line": 10,
        "path": "admin/build/gen_twins.py",
        "sha256": "970b3654f1e836ffd9a55f7446e8a001bb5f9e8502859041e135eff34067b450"
      },
      "to": "module:admin/build/chrome.py",
      "verb": "imports"
    },
    {
      "from": "module:admin/build/gen_twins.py",
      "source": {
        "end": 11,
        "line": 11,
        "path": "admin/build/gen_twins.py",
        "sha256": "970b3654f1e836ffd9a55f7446e8a001bb5f9e8502859041e135eff34067b450"
      },
      "to": "module:admin/build/html_to_md.py",
      "verb": "imports"
    },
    {
      "from": "module:admin/build/gen_twins.py",
      "source": {
        "end": 12,
        "line": 12,
        "path": "admin/build/gen_twins.py",
        "sha256": "970b3654f1e836ffd9a55f7446e8a001bb5f9e8502859041e135eff34067b450"
      },
      "to": "module:admin/build/pages.py",
      "verb": "imports"
    },
    {
      "from": "module:admin/build/gen_versions.py",
      "source": {
        "end": 13,
        "line": 13,
        "path": "admin/build/gen_versions.py",